{
  "$comment": "Wortlaut aus der freigegebenen Fassung VA_BKM_RD_ReparaturDicht_DE, ausgegeben am 18.08.2026. Vollstaendige Uebernahme, nicht verdichtet - die vorherige Fassung war eine Zusammenfassung, in der 11 von 33 Saetzen der Vorlage fehlten. Abnahme: jeder Satz der Vorlage muss mit einem Acht-Wort-Fenster in dieser Datei wiederzufinden sein. Fuenf Eingriffe, alle hier genannt: (1) Die Rubrik ANLEITUNG steht in der Vorlage auf einer Seite; hier auf zwei, weil eine Seite 259 mm Satzhoehe fasst und der Text vollstaendig steht. (2) Fliesstext der Vorlage steht teils als bullets, wo es Einzelanweisungen sind; Wortlaut je Satz unveraendert. (3) Die Werkzeugliste nennt genau die drei Gegenstaende der Vorlage - Rolle, Abdeckmaterial, Verduennung zur Werkzeugreinigung; die vorherige Fassung hatte Pinsel, Holzruehrstab und Vlies ergaenzt, die im Text vorkommen, aber nicht in der Werkzeugliste stehen. (4) Die Subheadline der Vorlage ist zweiteilig ('Die streichbare Sofortloesung fuer Detailreparaturen am Dach. Sicher abdichten - in einem Zug'); auf dem Titel steht der erste Teil, der zweite im intro_text. (5) Die Vorlage schreibt 'Die Untergrund Vorbehandlung' - hier steht 'Die Untergrundvorbehandlung'. Keine Bilder geliefert - alle Abbildungen als image_needed beschrieben.",
  "title": "BKM RD ReparaturDicht – Verarbeitungsanleitung",
  "product_name": "BKM RD ReparaturDicht",
  "product_line": "PRO LINE",
  "document_rubrik": "Verarbeitungsanleitung",
  "created_date": "18.08.2026",
  "source_pdf": "VA_BKM_RD_ReparaturDicht_DE",
  "page_number_start": 2,
  "page_total": 5,
  "cover": {
    "headline": "VERARBEITUNGS-<br>ANLEITUNG",
    "subheadline": "Die streichbare Sofortlösung für Detailreparaturen am Dach.",
    "intro_text": "BKM RD ReparaturDicht – Dauerelastische Reparaturmasse. Sicher abdichten – in einem Zug.",
    "hero_image_alt": "BKM RD ReparaturDicht Verarbeitungsanleitung"
  },
  "pages": [
    {
      "type": "vorbereitung",
      "running_head": "BKM RD ReparaturDicht",
      "scope": {
        "title": "Anwendungsbereich",
        "icon": "table",
        "body": "Zur Ausbesserung und Reparatur von Dächern, Garagendächern, Carports, Gartenhäusern sowie Neben- und Wirtschaftsgebäuden. Geeignet für zahlreiche Untergründe wie:",
        "suitable": [
          "Beton",
          "Dachpappe",
          "Bitumen",
          "Schweißbahnen",
          "Ziegel",
          "Holz",
          "Metall und diverse Kunststoffe",
          "Dachrinnen"
        ],
        "unsuitable": [
          "Nicht geeignet für Styropor/Styrodur und frischen Beton."
        ]
      },
      "advantages": [
        {
          "icon": "shield-check",
          "claim": "Dichtet Beschädigungen sicher ab",
          "detail": "verschließt Risse und Fehlstellen dauerhaft und verhindert das Eindringen von Wasser und Schmutz"
        },
        {
          "icon": "drop",
          "claim": "Witterungs- und UV-beständig",
          "detail": "behält seine Funktion auch bei Sonne, Regen, Frost und starken Temperaturschwankungen"
        },
        {
          "icon": "check-circle",
          "claim": "Ohne Primer sofort einsetzbar",
          "detail": "Anwendung ohne Grundierung spart Zeit und vereinfacht die Verarbeitung"
        }
      ],
      "workplace": {
        "title": "Arbeitsplatz vorbereiten",
        "icon": "clipboard-text",
        "steps": [
          "Angrenzende Bauteile und Flächen sorgfältig abdecken und schützen.",
          "Untergrund auf Festigkeit prüfen, lose oder schadhafte Bereiche entfernen.",
          "Oberfläche gründlich reinigen und von Staub, Schmutz, Fett und Öl befreien.",
          "Glatte Untergründe wie Beton anschleifen, Metalle und Kunststoffe entfetten.",
          "Der Untergrund muss trocken sein."
        ]
      },
      "tools": {
        "title": "Für die Anwendung brauchst du",
        "items": [
          "Rolle",
          "Abdeckmaterial",
          "Verdünnung zur Werkzeugreinigung"
        ]
      },
      "safety": {
        "title": "Für deine eigene<br>Sicherheit",
        "items": [
          "Schutzbrille",
          "Schutzhandschuhe",
          "Schutzkleidung"
        ]
      }
    },
    {
      "type": "anleitung",
      "running_head": "BKM RD ReparaturDicht",
      "sections": [
        {
          "title": "Verbrauch planen",
          "icon": "drop",
          "body": "Vor Beginn ermittle die benötigte Menge für deine Reparaturarbeiten. Der Materialverbrauch liegt je nach Untergrund und Auftragsstärke bei ca. 0,5 bis 1,0 Liter pro Quadratmeter.",
          "bullets": [
            "Raue, strukturierte, stark saugende Untergründe können den Verbrauch erhöhen.",
            "Zur Vermeidung von Materialengpässen den Bedarf nicht zu knapp kalkulieren."
          ]
        },
        {
          "title": "Untergrund",
          "icon": "stack",
          "body": "Die Untergrundvorbehandlung ist entscheidend für die sichere Haftung. Metalle und Kunststoffe müssen vorab entfettet werden und Betonoberflächen sollten geschliffen werden. Alle Untergründe müssen frei von Verunreinigungen wie z. B. Laub und Moos sein."
        }
      ],
      "figures": [
        {
          "caption": "Untergrund reinigen und vorbereiten",
          "image_needed": "Foto, 16:9: gereinigte Dachfläche, Entfernen von Laub und Moos, angeschliffene Betonkante. Bei KI-generiertem Motiv Vermerk AI GENERATED in der unteren rechten Ecke."
        },
        {
          "caption": "Dichtbereich abkleben",
          "image_needed": "Foto, 16:9: abgeklebter Dichtbereich mit sauberer Kante vor dem Auftrag. Bei KI-generiertem Motiv Vermerk AI GENERATED in der unteren rechten Ecke."
        }
      ]
    },
    {
      "type": "anleitung",
      "running_head": "BKM RD ReparaturDicht",
      "sections": [
        {
          "title": "Verarbeitung",
          "icon": "hammer",
          "body": "BKM RD ReparaturDicht ist gebrauchsfertig und darf nicht verdünnt werden.",
          "bullets": [
            "Rühre das Material vor der Verarbeitung im Gebinde kurz auf. Zum Aufrühren kannst du einen Holzrührstab verwenden.",
            "Trage das Produkt gleichmäßig mit einem breiten Pinsel, einer Rolle oder einem geeigneten Flächenstreicher auf. Dabei wird es satt und vollflächig auf den gereinigten und vorbereiteten Untergrund aufgetragen, bis eine geschlossene, porenfreie Beschichtung entsteht.",
            "An kritischen Stellen wie z. B. Übergängen, Nähten, Rissen oder Materialwechseln empfiehlt es sich, ein Vlies in die noch frische erste Beschichtung einzubetten und anschließend mit einer zweiten Schicht nass in nass zu überarbeiten.",
            "Bei höheren Beanspruchungen oder zur Erhöhung der Schichtstärke kannst du nach vollständiger Durchtrocknung (nach ca. 14 Tagen) einen zweiten Auftrag ausführen."
          ]
        },
        {
          "title": "Hinweise",
          "icon": "warning",
          "bullets": [
            "Die Verarbeitung darf nur bei trockenem Wetter und Temperaturen zwischen +5 °C und +40 °C erfolgen.",
            "Die Zeit bis zur Hautbildung ist abhängig von den Umgebungsbedingungen und liegt bei ca. 45–60 min.",
            "Bei Hautbildung an der Oberfläche: weiteren Auftrag erst nach ca. 14 Tagen ausführen.",
            "Während der Aushärtung ist die Fläche vor Regen, Staunässe und Verschmutzung zu schützen.",
            "Die Aushärtung erfolgt durch Verdunstung und beträgt ca. 1–2 mm pro Tag, abhängig von Temperatur, Schichtdicke und Luftfeuchtigkeit."
          ]
        }
      ],
      "figures": [
        {
          "caption": "Satt und vollflächig auftragen",
          "image_needed": "Foto, 16:9: Auftrag mit breitem Pinsel oder Rolle bis zur geschlossenen, porenfreien Beschichtung. Bei KI-generiertem Motiv Vermerk AI GENERATED in der unteren rechten Ecke."
        },
        {
          "caption": "Vlies an kritischen Stellen einbetten",
          "image_needed": "Foto, 16:9: Vlies wird in die frische erste Beschichtung an einer Naht eingebettet. Bei KI-generiertem Motiv Vermerk AI GENERATED in der unteren rechten Ecke."
        }
      ],
      "tip": {
        "title": "Profi Tipp",
        "body": "Dichtbereich abkleben. Spart Material – schafft saubere Kanten."
      }
    },
    {
      "type": "nacharbeit",
      "running_head": "BKM RD ReparaturDicht",
      "headline": "Abschluss und Reinigung",
      "icon": "check-circle",
      "steps": [
        "Werkzeuge nur mit Verdünnung reinigen.",
        "Abdeckmaterial vor vollständiger Trocknung entfernen.",
        "Produktreste und leere Gebinde fachgerecht entsorgen.",
        "Gebinde gut verschlossen sowie kühl und trocken lagern."
      ],
      "created_date": "18.08.2026",
      "copyright": "Copyright BKM.MANNESMANN AG · Wideystraße 23 · 59174 Kamen · Germany · Phone: +49 (0) 2307-99034-0 · www.bkm-mannesmann.de · All rights reserved. Reproduction only with our permission."
    }
  ],
  "review": {
    "abgleich": "29 von 33 Sätzen der Vorlage wiedergefunden. Die vier übrigen sind Artefakte der Textextraktion.",
    "korrekturen": [
      "Die Vorlage schreibt „Die Untergrund Vorbehandlung“. Hier steht „Die Untergrundvorbehandlung“."
    ],
    "eingriffe": [
      "Die Rubrik Anleitung steht in der Vorlage auf einer Seite, hier auf zwei.",
      "Die Subheadline der Vorlage ist zweiteilig. Auf dem Titel steht der erste Teil, der zweite im Vorspann.",
      "Die Werkzeugliste nennt genau die drei Gegenstände der Vorlage. Pinsel, Holzrührstab und Vlies kommen im Text vor, stehen dort aber nicht in der Liste."
    ]
  }
}
